{
  "$schema": "../../schema/action.schema.json",
  "type": "mcp",
  "name": "GitHub",
  "version": "1.0.0",
  "summary": "Issues, pull requests and code on GitHub, with your own access",
  "description": "GitHub's hosted MCP server. It runs with the personal access token you supply at install; the token never leaves your node.",
  "vendor": "github",
  "symbol": "chevron.left.forwardslash.chevron.right",
  "category": "Developer",
  "homepage": "https://github.com/github/github-mcp-server",
  "contributors": [
    { "name": "KeepTalking", "role": "maintainer" },
    { "name": "GitHub", "role": "upstream", "url": "https://github.com/github/github-mcp-server" }
  ],
  "secrets": [
    {
      "key": "token",
      "label": "Personal access token",
      "description": "A fine-grained token scoped to the repositories you want KeepTalking to reach.",
      "url": "https://github.com/settings/personal-access-tokens/new"
    }
  ],
  "mcp": {
    "http": {
      "url": "https://api.githubcopilot.com/mcp/",
      "headers": { "Authorization": "Bearer ${secret:token}" }
    }
  }
}
